nome,lattes_url,ano_publicacao,titulo_publicacao,periodico,issn,qualis,pontos,area,ano_base
"Luciano Andrade Moreira",http://lattes.cnpq.br/5832739049925970,2023,"Egg-laying by female Aedes aegypti shapes the bacterial communities of breeding sites","BMC BIOLOGY",1741-7007,A1,,,2020
"Luciano Andrade Moreira",http://lattes.cnpq.br/5832739049925970,2023,"Genomic epidemiology unveils the dynamics and spatial corridor behind the Yellow Fever virus outbreak in Southern Brazil","SCIENCE ADVANCES",2375-2548,A1,,,2020
"Luciano Andrade Moreira",http://lattes.cnpq.br/5832739049925970,2022,"EVITA Dengue: a cluster-randomized controlled trial to EValuate the efficacy of Wolbachia-InfecTed Aedes aegypti mosquitoes in reducing the incidence of Arboviral infection in Brazil","TRIALS",1745-6215,B1,,,2020
"Luciano Andrade Moreira",http://lattes.cnpq.br/5832739049925970,2022,"Wolbachia pipientis modulates metabolism and immunity during Aedes fluviatilis oogenesis","INSECT BIOCHEMISTRY AND MOLECULAR BIOLOGY",0965-1748,A1,,,2020
"Luciano Andrade Moreira",http://lattes.cnpq.br/5832739049925970,2022,"AG129 Mice as a Comprehensive Model for the Experimental Assessment of Mosquito Vector Competence for Arboviruses","PATHOGENS",2076-0817,A3,,,2020
"Luciano Andrade Moreira",http://lattes.cnpq.br/5832739049925970,2022,"Estimating the effect of the wMel release programme on the incidence of dengue and chikungunya in Rio de Janeiro, Brazil: a spatiotemporal modelling study","LANCET INFECTIOUS DISEASES",1473-3099,A1,,,2020
"Luciano Andrade Moreira",http://lattes.cnpq.br/5832739049925970,2021,"The influence of different sources of blood meals on the physiology of Aedes aegypti harboring Wolbachia wMel: mouse blood as an alternative for mosquito rearing","PARASITES & VECTORS",1756-3305,A2,,,2020
"Luciano Andrade Moreira",http://lattes.cnpq.br/5832739049925970,2021,"Mayaro Virus: The Potential Role of Microbiota and Wolbachia","PATHOGENS",2076-0817,A3,,,2020
"Luciano Andrade Moreira",http://lattes.cnpq.br/5832739049925970,2021,"Evaluation of Aedes aegypti, Aedes albopictus, and Culex quinquefasciatus Mosquitoes? Competence to Oropouche virus Infection","VIRUSES-BASEL",1999-4915,A2,,,2020
"Luciano Andrade Moreira",http://lattes.cnpq.br/5832739049925970,2021,"Reduced competence to arboviruses following the sustainable invasion of Wolbachia into native Aedes aegypti from Southeastern Brazil","SCIENTIFIC REPORTS",2045-2322,A1,,,2020
"Luciano Andrade Moreira",http://lattes.cnpq.br/5832739049925970,2021,"Wolbachia as translational science: controlling mosquito-borne pathogens","TRENDS IN PARASITOLOGY",1471-4922,A1,,,2020
"Luciano Andrade Moreira",http://lattes.cnpq.br/5832739049925970,2021,"Effectiveness of Wolbachia-infected mosquito deployments in reducing the incidence of dengue and other Aedes-borne diseases in Niterói, Brazil: A quasi-experimental study","PLOS NEGLECTED TROPICAL DISEASES",1935-2735,A1,,,2020
"Luciano Andrade Moreira",http://lattes.cnpq.br/5832739049925970,2021,"Multi-Omic Analysis of Symbiotic Bacteria Associated With Aedes aegypti Breeding Sites","FRONTIERS IN MICROBIOLOGY",1664-302X,A2,,,2020
"Luciano Andrade Moreira",http://lattes.cnpq.br/5832739049925970,2021,"Large-Scale Deployment and Establishment of Wolbachia Into the Aedes aegypti Population in Rio de Janeiro, Brazil","FRONTIERS IN MICROBIOLOGY",1664-302X,A2,,,2020
"Luciano Andrade Moreira",http://lattes.cnpq.br/5832739049925970,2021,"Aedes fluviatilis cell lines as new tools to study metabolic and immune interactions in mosquito-Wolbachia symbiosis","SCIENTIFIC REPORTS",2045-2322,A1,,,2020
"Luciano Andrade Moreira",http://lattes.cnpq.br/5832739049925970,2020,"Vector competence of Aedes aegypti, Aedes albopictus, and Culex quinquefasciatus mosquitoes for Mayaro virus","PLOS NEGLECTED TROPICAL DISEASES",1935-2735,A1,,,2020
"Luciano Andrade Moreira",http://lattes.cnpq.br/5832739049925970,2020,"Insect vectors endosymbionts as solutions against diseases","CURRENT OPINION IN INSECT SCIENCE",2214-5745,A1,,,2020
"Luciano Andrade Moreira",http://lattes.cnpq.br/5832739049925970,2020,"Historical Perspective and Biotechnological Trends to Block Arboviruses Transmission by Controlling Aedes aegypti Mosquitos Using Different Approaches","FRONTIERS IN MEDICINE",2296-858X,A1,,,2020
"Luciano Andrade Moreira",http://lattes.cnpq.br/5832739049925970,2020,"The RNAi Pathway Is Important to Control Mayaro Virus Infection in Aedes aegypti but not for Wolbachia-Mediated Protection","VIRUSES-BASEL",1999-4915,A2,,,2020
"Luciano Andrade Moreira",http://lattes.cnpq.br/5832739049925970,2020,"Dengue infection modulates locomotion and host seeking in Aedes aegypti","PLOS NEGLECTED TROPICAL DISEASES",1935-2735,A1,,,2020
"Luciano Andrade Moreira",http://lattes.cnpq.br/5832739049925970,2020,"How to engage communities on a large scale? Lessons from World Mosquito Program in Rio de Janeiro, Brazil","GATES OPEN RESEARCH",2572-4754,A4,,,2020
"Luciano Andrade Moreira",http://lattes.cnpq.br/5832739049925970,2019,"Wolbachia introduction into Lutzomyia longipalpis (Diptera: Psychodidae) cell lines and its effects on immune-related gene expression and interaction with Leishmania infantum","PARASITES & VECTORS",1756-3305,A2,,,2020
"Luciano Andrade Moreira",http://lattes.cnpq.br/5832739049925970,2019,"Matching the genetics of released and local Aedes aegypti populations is critical to assure Wolbachia invasion","PLOS NEGLECTED TROPICAL DISEASES",1935-2735,A1,,,2020
"Luciano Andrade Moreira",http://lattes.cnpq.br/5832739049925970,2019,"The Perfect Appetizer: A Pharmacological Strategy for a Non-biting Mosquito","CELL",0092-8674,A1,,,2020
"Luciano Andrade Moreira",http://lattes.cnpq.br/5832739049925970,2019,"Pluripotency of Wolbachia against Arboviruses: the case of yellow fever","GATES OPEN RESEARCH",2572-4754,A4,,,2020
"Luciano Andrade Moreira",http://lattes.cnpq.br/5832739049925970,2019,"Pathogen blocking in Wolbachia-infected Aedes aegypti is not affected by Zika and dengue virus co-infection","PLOS NEGLECTED TROPICAL DISEASES",1935-2735,A1,,,2020
"Luciano Andrade Moreira",http://lattes.cnpq.br/5832739049925970,2019,"Embryonic development and egg viability of wMel-infected Aedes aegypti","PARASITES & VECTORS",1756-3305,A2,,,2020
"Luciano Andrade Moreira",http://lattes.cnpq.br/5832739049925970,2019,"Detection of Yellow Fever Virus in Sylvatic Mosquitoes during Disease Outbreaks of 2017-2018 in Minas Gerais State, Brazil","INSECTS",2075-4450,A2,,,2020
"Luciano Andrade Moreira",http://lattes.cnpq.br/5832739049925970,2019,"The impact of large-scale deployment of Wolbachia mosquitoes on dengue and other Aedes-borne diseases in Rio de Janeiro and Niterói, Brazil: study protocol for a controlled interrupted time series analysis using routine disease surveillance data","F1000RESEARCH",2046-1402,A3,,,2020
"Luciano Andrade Moreira",http://lattes.cnpq.br/5832739049925970,2018,"Inhibition of the complement system by saliva of Anopheles (Nyssorhynchus) aquasalis","INSECT BIOCHEMISTRY AND MOLECULAR BIOLOGY",0965-1748,A1,,,2020
"Luciano Andrade Moreira",http://lattes.cnpq.br/5832739049925970,2018,"Wolbachia significantly impacts the vector competence of Aedes aegypti for Mayaro virus","SCIENTIFIC REPORTS",2045-2322,A1,,,2020
"Luciano Andrade Moreira",http://lattes.cnpq.br/5832739049925970,2018,"In tune with nature: Wolbachia does not prevent pre-copula acoustic communication in Aedes aegypti","PARASITES & VECTORS",1756-3305,A2,,,2020
"Luciano Andrade Moreira",http://lattes.cnpq.br/5832739049925970,2018,"Control of dengue virus in the midgut of Aedes aegypti by ectopic expression of the dsRNA-binding protein Loqs2","NATURE MICROBIOLOGY",2058-5276,A1,,,2020
"Luciano Andrade Moreira",http://lattes.cnpq.br/5832739049925970,2017,"The transcriptome of the mosquito Aedes fluviatilis (Diptera: Culicidae), and transcriptional changes associated with its native Wolbachia infection","BMC GENOMICS",1471-2164,A2,,,2020
"Luciano Andrade Moreira",http://lattes.cnpq.br/5832739049925970,2017,"Why is Aedes aegypti Linnaeus so Successful as a Species?","NEOTROPICAL ENTOMOLOGY",1519-566X,A4,,,2020
"Luciano Andrade Moreira",http://lattes.cnpq.br/5832739049925970,2017,"The impact of Wolbachia infection on the rate of vertical transmission of dengue virus in Brazilian Aedes aegypti","PARASITES & VECTORS",1756-3305,A2,,,2020
"Luciano Andrade Moreira",http://lattes.cnpq.br/5832739049925970,2017,"Wolbachia infection in Aedes aegypti mosquitoes alters blood meal excretion and delays oviposition without affecting trypsin activity","INSECT BIOCHEMISTRY AND MOLECULAR BIOLOGY",0965-1748,A1,,,2020
"Luciano Andrade Moreira",http://lattes.cnpq.br/5832739049925970,2017,"Wolbachia and dengue virus infection in the mosquito Aedes fluviatilis (Diptera: Culicidae)","PLOS ONE",1932-6203,A1,,,2020
"Luciano Andrade Moreira",http://lattes.cnpq.br/5832739049925970,2017,"How does competition among wild type mosquitoes influences the performance of Aedes aegypti and dissemination of Wolbachia pipientis?","PLOS NEGLECTED TROPICAL DISEASES",1935-2735,A1,,,2020
"Luciano Andrade Moreira",http://lattes.cnpq.br/5832739049925970,2017,"Development and physiological effects of an artificial diet for Wolbachia-infected Aedes aegypti","SCIENTIFIC REPORTS",2045-2322,A1,,,2020
"Luciano Andrade Moreira",http://lattes.cnpq.br/5832739049925970,2016,"Wolbachia Blocks Currently Circulating Zika Virus Isolates in Brazilian Aedes aegypti Mosquitoes","CELL HOST & MICROBE",1931-3128,A1,,,2020
"Luciano Andrade Moreira",http://lattes.cnpq.br/5832739049925970,2016,"The influence of larval competition on Brazilian Wolbachia-infected Aedes aegypti mosquitoes","PARASITES & VECTORS",1756-3305,A2,,,2020
"Luciano Andrade Moreira",http://lattes.cnpq.br/5832739049925970,2016,"Molecular basis of the remarkable species selectivity of an insecticidal sodium channel toxin from the African spider Augacephalus ezendami","SCIENTIFIC REPORTS",2045-2322,A1,,,2020
"Luciano Andrade Moreira",http://lattes.cnpq.br/5832739049925970,2016,"Inhibition of Zika virus by Wolbachia in Aedes aegypti","MICROBIAL CELL",2311-2638,A4,,,2020
"Luciano Andrade Moreira",http://lattes.cnpq.br/5832739049925970,2016,"Zika control through the bacterium","FUTURE MICROBIOLOGY (PRINT)",1746-0913,A3,,,2020
"Luciano Andrade Moreira",http://lattes.cnpq.br/5832739049925970,2016,"The re-emerging arboviral threat: Hidden enemies","BIOESSAYS (CAMBRIDGE)",0265-9247,A1,,,2020
"Luciano Andrade Moreira",http://lattes.cnpq.br/5832739049925970,2016,"Diet-Induced Nutritional Stress and Pathogen Interference in Wolbachia-Infected Aedes aegypti","PLOS NEGLECTED TROPICAL DISEASES (ONLINE)",1935-2735,A1,,,2020
"Luciano Andrade Moreira",http://lattes.cnpq.br/5832739049925970,2015,"Broader prevalence of Wolbachia in insects including potential human disease vectors","BULLETIN OF ENTOMOLOGICAL RESEARCH",0007-4853,A2,,,2020
"Luciano Andrade Moreira",http://lattes.cnpq.br/5832739049925970,2015,"From Lab to Field: The Influence of Urban Landscapes on the Invasive Potential of Wolbachia in Brazilian Aedes aegypti Mosquitoes","PLOS NEGLECTED TROPICAL DISEASES (ONLINE)",1935-2735,A1,,,2020
"Luciano Andrade Moreira",http://lattes.cnpq.br/5832739049925970,2015,"Exploiting Intimate Relationships: Controlling Mosquito-Transmitted Disease with Wolbachia","TRENDS IN PARASITOLOGY",1471-4922,A1,,,2020
"Luciano Andrade Moreira",http://lattes.cnpq.br/5832739049925970,2014,"The Modulation of the Symbiont/Host Interaction between Wolbachia pipientis and Aedes fluviatilis Embryos by Glycogen Metabolism","PLOS ONE",1932-6203,A1,,,2020
"Luciano Andrade Moreira",http://lattes.cnpq.br/5832739049925970,2014,"Wolbachia detection in insects through LAMP: loop mediated isothermal amplification","PARASITES & VECTORS",1756-3305,A2,,,2020
"Luciano Andrade Moreira",http://lattes.cnpq.br/5832739049925970,2013,"wFlu: Characterization and Evaluation of a Native Wolbachia from the Mosquito Aedes fluviatilis as a Potential Vector Control Agent","PLOS ONE",1932-6203,A1,,,2020
"Luciano Andrade Moreira",http://lattes.cnpq.br/5832739049925970,2013,"Harnessing mosquito-Wolbachia symbiosis for vector and disease control","ACTA TROPICA",0001-706X,A2,,,2020
"Luciano Andrade Moreira",http://lattes.cnpq.br/5832739049925970,2012,"A portable approach for the surveillance of dengue virus-infected mosquitoes","JOURNAL OF VIROLOGICAL METHODS",0166-0934,B2,,,2020
"Luciano Andrade Moreira",http://lattes.cnpq.br/5832739049925970,2012,"Why do we need alternative tools to control mosquito-borne diseases in Latin America?","MEMÓRIAS DO INSTITUTO OSWALDO CRUZ (IMPRESSO)",0074-0276,A4,,,2020
"Luciano Andrade Moreira",http://lattes.cnpq.br/5832739049925970,2011,"Infection with the wMel and wMelPop strains of Wolbachia leads to higher levels of melanization in the hemolymph of Drosophila melanogaster, Drosophila simulans and Aedes aegypti","DEVELOPMENTAL AND COMPARATIVE IMMUNOLOGY",0145-305X,A1,,,2020
"Luciano Andrade Moreira",http://lattes.cnpq.br/5832739049925970,2011,"Improved accuracy of the transcriptional profiling method of age grading in Aedes aegypti mosquitoes under laboratory and semi-field cage conditions and in the presence of Wolbachia infection","INSECT MOLECULAR BIOLOGY (PRINT)",0962-1075,A1,,,2020
"Luciano Andrade Moreira",http://lattes.cnpq.br/5832739049925970,2011,"The wMelPop strain of Wolbachia interferes with dopamine levels in Aedes aegypti","PARASITES & VECTORS",1756-3305,A2,,,2020
"Luciano Andrade Moreira",http://lattes.cnpq.br/5832739049925970,2011,"Identification of a fibrinogen-related protein (FBN9) gene in neotropical anopheline mosquitoes","MALARIA JOURNAL (ONLINE)",1475-2875,A2,,,2020
"Luciano Andrade Moreira",http://lattes.cnpq.br/5832739049925970,2011,"Wolbachia uses host microRNAs to manipulate host gene expression and facilitate colonization of the dengue vector Aedes aegypti","PROCEEDINGS OF THE NATIONAL ACADEMY OF SCIENCES OF THE UNITED STATES OF AMERICA",0027-8424,A1,,,2020
"Luciano Andrade Moreira",http://lattes.cnpq.br/5832739049925970,2011,"The wMel Wolbachia strain blocks dengue and invades caged Aedes aegypti populations","NATURE (LONDON)",0028-0836,A1,,,2020
"Luciano Andrade Moreira",http://lattes.cnpq.br/5832739049925970,2011,"Can Wolbachia be used to control malaria?","MEMÓRIAS DO INSTITUTO OSWALDO CRUZ (IMPRESSO)",0074-0276,A4,,,2020
"Luciano Andrade Moreira",http://lattes.cnpq.br/5832739049925970,2010,"Fitness aspects of transgenic Aedes fluviatilis mosquitoes expressing a Plasmodium-blocking molecule","TRANSGENIC RESEARCH",0962-8819,A2,,,2020
"Luciano Andrade Moreira",http://lattes.cnpq.br/5832739049925970,2010,"Assessing key safety concerns of a Wolbachia-based strategy to control dengue transmission by Aedes mosquitoes","MEMÓRIAS DO INSTITUTO OSWALDO CRUZ (IMPRESSO)",0074-0276,A4,,,2020
"Luciano Andrade Moreira",http://lattes.cnpq.br/5832739049925970,2009,"Anti-Anopheles darlingi saliva antibodies as marker of Plasmodium vivax infection and clinical immunity in the Brazilian Amazon","MALARIA JOURNAL (ONLINE)",1475-2875,A2,,,2020
"Luciano Andrade Moreira",http://lattes.cnpq.br/5832739049925970,2009,"Wolbachia Infection Reduces Blood-Feeding Success in the Dengue Fever Mosquito, Aedes aegypti","PLOS NEGLECTED TROPICAL DISEASES",1935-2735,A1,,,2020
"Luciano Andrade Moreira",http://lattes.cnpq.br/5832739049925970,2009,"Antibiosis of eight Lycopersicon genotypes to Tuta absoluta  (Lepidoptera: Gelechiidae)","REVISTA CERES",0034-737X,B1,,,2020
"Luciano Andrade Moreira",http://lattes.cnpq.br/5832739049925970,2009,"Human Probing Behavior of Aedes aegypti when Infected with a Life-Shortening Strain of Wolbachia","PLOS NEGLECTED TROPICAL DISEASES",1935-2735,A1,,,2020
"Luciano Andrade Moreira",http://lattes.cnpq.br/5832739049925970,2009,"A Wolbachia Symbiont in Aedes aegypti Limits Infection with Dengue, Chikungunya, and Plasmodium","CELL (CAMBRIDGE)",0092-8674,A1,,,2020
"Luciano Andrade Moreira",http://lattes.cnpq.br/5832739049925970,2008,"Expression of a mutated phospholipase A in transgenic Aedes fluviatilis mosquitoes impacts Plasmodium gallinaceum development","INSECT MOLECULAR BIOLOGY (PRINT)",0962-1075,A1,,,2020
"Luciano Andrade Moreira",http://lattes.cnpq.br/5832739049925970,2008,"Transmission control of schistosomiasis mansoni by introduction of a resistant strain of Biomphalaria tenagophila in areas where transmission is maintained by this species","ACTA TROPICA",0001-706X,A2,,,2020
"Luciano Andrade Moreira",http://lattes.cnpq.br/5832739049925970,2007,"Effect of the Antimicrobial Peptide Gomesin Against Different Life Stages of Plasmodium spp.","EXPERIMENTAL PARASITOLOGY",0014-4894,A4,,,2020
"Luciano Andrade Moreira",http://lattes.cnpq.br/5832739049925970,2006,"Germline transformation of Aedes fluviatilis (Diptera:Culicidae) with the piggyBac transposable element","MEMÓRIAS DO INSTITUTO OSWALDO CRUZ (IMPRESSO)",0074-0276,A4,,,2020
"Luciano Andrade Moreira",http://lattes.cnpq.br/5832739049925970,2006,"Mosquitos transgênicos: possível arma contra a malária","CIÊNCIA HOJE",0101-8515,N,,,
"Luciano Andrade Moreira",http://lattes.cnpq.br/5832739049925970,2005,"Driving midgut-specific expression and secretion of a foreign protein in transgenic mosquitoes with AgAper1 regulatory elements","INSECT MOLECULAR BIOLOGY (PRINT)",0962-1075,A1,,,2020
"Luciano Andrade Moreira",http://lattes.cnpq.br/5832739049925970,2004,"Fitness of Anopheline Mosquitoes Expressing Transgenes That Inhibit Plasmodium Development","GENETICS (AUSTIN, TEX.)",0016-6731,A2,,,2020
"Luciano Andrade Moreira",http://lattes.cnpq.br/5832739049925970,2004,"Biomphalaria tenagophila/Schistosoma mansoni interaction: premises for a new approach to biological control of schistosomiasis","MEMÓRIAS DO INSTITUTO OSWALDO CRUZ (IMPRESSO)",0074-0276,A4,,,2020
"Luciano Andrade Moreira",http://lattes.cnpq.br/5832739049925970,2003,"Transgenic mosquitoes for malaria control: progresses and challenges","NEOTROPICAL ENTOMOLOGY (IMPRESSO)",1519-566X,A4,,,2020
"Luciano Andrade Moreira",http://lattes.cnpq.br/5832739049925970,2002,"Plasmodium-mosquito interactions, phage display libraries and transgenic mosquitoes impaired for malaria transmission","INSECT BIOCHEMISTRY AND MOLECULAR BIOLOGY",0965-1748,A1,,,2020
"Luciano Andrade Moreira",http://lattes.cnpq.br/5832739049925970,2002,"Transgenic anopheline mosquitoes impaired in transmission of a malaria parasite","NATURE (LONDON)",0028-0836,A1,,,2020
"Luciano Andrade Moreira",http://lattes.cnpq.br/5832739049925970,2002,"Bee Venom Phospholipase Inhibits Malaria Parasite Development in Transgenic Mosquitoes","THE JOURNAL OF BIOLOGICAL CHEMISTRY (PRINT)",0021-9258,A1,,,2020
"Luciano Andrade Moreira",http://lattes.cnpq.br/5832739049925970,2002,"Genetic transformation of mosquitoes: a quest for malaria control","INTERNATIONAL JOURNAL FOR PARASITOLOGY",0020-7519,A1,,,2020
"Luciano Andrade Moreira",http://lattes.cnpq.br/5832739049925970,2000,"Robust gut-specific gene expression in transgenic Aedes aegypti mosquitoes.","PROCEEDINGS OF THE NATIONAL ACADEMY OF SCIENCES OF THE UNITED STATES OF AMERICA",0027-8424,A1,,,2020
"Luciano Andrade Moreira",http://lattes.cnpq.br/5832739049925970,1999,"Search for molecular markers linked to Liriomyza trifolii resistance in tomato.","EUPHYTICA (WAGENINGEN)",0014-2336,A2,,,2020
"Luciano Andrade Moreira",http://lattes.cnpq.br/5832739049925970,1998,"Dados Biológicos de Podisus nigrispinus (Dallas) Alimentado com a Lagarta do Maracujazeiro Dione juno juno (Cramer).","ANAIS DA SOCIEDADE ENTOMOLÓGICA DO BRASIL",0301-8059,N,,,
"Luciano Andrade Moreira",http://lattes.cnpq.br/5832739049925970,1997,"Effect of Eucalyptus feeding in the development, survival and reproduction of Tynacantha marginata 	(Heteroptera: Pentatomidae).","REVISTA DE BIOLOGIA TROPICAL",,N,,,
"Luciano Andrade Moreira",http://lattes.cnpq.br/5832739049925970,1996,"Aspectos Biomorfológicos de Tynacantha marginata Dallas (Heteroptera: Pentatomidae) Alimentado com Larvas de Tenebrio molitor L. (Coleoptera: Tenebrionidae).","ANAIS DA SOCIEDADE ENTOMOLÓGICA DO BRASIL",0301-8059,N,,,
"Luciano Andrade Moreira",http://lattes.cnpq.br/5832739049925970,1995,"Tabelas de fertilidade e de esperança de vida de Tynacantha marginata Dallas (Heteroptera, Pentatomidae, Asopinae) alimentado com larvas de Tenebrio molitor L. (Coleoptera, Tenebrionidae) e folhas de Eucalyptus urophylla S.T. Blake","REVISTA BRASILEIRA DE ZOOLOGIA",0101-8175,B1,,,2020
"Luciano Andrade Moreira",http://lattes.cnpq.br/5832739049925970,1993,"Efeito da Densidade Ninfal na Viabilidade e Sobrevivência de Supputius cincticeps Stal, 1860 (Hemiptera: Pentatomidae) Criado em Laboratório com larvas de Tenebrio molitor (Coleoptera: Tenebrionidae).","REVISTA BRASILEIRA DE ENTOMOLOGIA",0085-5626,A4,,,2020