Álvaro Gil Araújo Ferreira,2621628661003591,PPGCS,Colaborador
Carina Margonari de Souza,1722996582628218,PPGCS,Colaborador
Cristiana Couto Garcia,1125391664500711,PPGCS,Colaborador
Daniel Moreira de Avelar,3544791535477213,PPGCS,Colaborador
Érica Alessandra Rocha Alves,9853093673691832,PPGCS,Colaborador
Erika Michalsky Monteiro,1476232727069800,PPGCS,Colaborador
Gabriel da Rocha Fernandes,8989178759075946,PPGCS,Colaborador
Gustavo Fontes Paz,7529793133786376,PPGCS,Colaborador
Luiz Carlos Júnior Alcantara,7428560072021675,PPGCS,Colaborador
Paloma Helena Fernandes Shimabukuro,3508138338414003,PPGCS,Colaborador
Pedro Augusto Alves,6935282825820547,PPGCS,Colaborador
Rafaella Fortini Grenfell e Queiroz,5508945613911003,PPGCS,Colaborador
Rita de Cássia Moreira de Souza,2586445059585013,PPGCS,Colaborador
Rosiane Aparecida da Silva Pereira,6405912413079760,PPGCS,Colaborador
Roney Santos Coimbra,3118219944250108,PPGCS,Colaborador
Soraya Torres Gaze Jangola,2290676372091813,PPGCS,Colaborador
Tânia Maria de Almeida Alves,5633763429024541,PPGCS,Colaborador
Antonio Mauro Rezende,8641629843495094,PPGCS,Colaborador